{"authority":{"authority_evidence_digest":"sha256:05095d596e79c23a49159147d3130f7aa4e3133bd0353b485b71b1c50c62e3a9","authority_id":"issue-278-sample-bootstrap-authority","authority_revision":"1","kind":"external_portfolio_activation_authority"},"context_digest":"sha256:ab1e39162bc96447f53ca5392cd1f6756dd66b8ffd03707a4d2a977bbd906e14","grant_basis_digest":"sha256:4f53cda18c2baa0c0354bb5f9a3ecbe5ed12ab4d8e11ba873c2f11161202b945","grants":[],"object_kind":"portfolio_authority_context","portfolio_id":"ask.portfolio.issue278.sample-runtime","predecessor_lock_digest":"sha256:f1d01ddd3e54aa6816d096c2333a8abf517246b2f65a7a8185ce907b9877a4bb","repository_id":"github.com/ist-h-i/agent-spectrum-kernel","rollback_target":null,"schema_version":"1.0.0","scope_id":"agent-spectrum-kernel","transition_basis_digest":"sha256:a5c7179eb80f47c5854a0f4c98dcd3ea278f721ad948c92f9350d14cd5501f93","transitions":[{"from_state":null,"manifest":{"asset_set_digest":"sha256:06ef54d6a0516d07d2b058a08b8a291d37f8e884bdb2ba6a924661776e8fb460","manifest_digest":"sha256:01b90828482e22833c6e246872c05b7a20349a0357eef8f9be9d587add0b893f","portfolio_id":"ask.portfolio.issue278.sample-runtime","revision":"sample-baseline-v1"},"to_state":"current"}]}
