{"authority":{"authority_evidence_digest":"sha256:f78a6bc4df598b1b27012a60d11aef197ac9a9f5764705afbb65762359f7692c","authority_id":"ask.prompt-v2.claude.challenger-portfolio-authority","authority_revision":"c508a767f3386dac10180770edf37a67806fbb1b","kind":"external_portfolio_activation_authority"},"context_digest":"sha256:00707e501bf423c383520b27ca1970ea04653710c70c89bd65b5e26e8136af60","grant_basis_digest":"sha256:4f53cda18c2baa0c0354bb5f9a3ecbe5ed12ab4d8e11ba873c2f11161202b945","grants":[],"object_kind":"portfolio_authority_context","portfolio_id":"ask.portfolio.prompt-v2.claude","predecessor_lock_digest":"sha256:95daef2bee6315f815c5fdd9137c72eb87666faa27659cd3dd069fb0f1bdd47c","repository_id":"github.com/ist-h-i/agent-spectrum-kernel","rollback_target":null,"schema_version":"1.0.0","scope_id":"agent-spectrum-kernel","transition_basis_digest":"sha256:155200ad2376fa937c6b836422f1841963c1331a3776d2f5e9c6978b644c362e","transitions":[{"from_state":"current","manifest":{"asset_set_digest":"sha256:292855fbc1d7819a404e75b2a4584fbf9003179495a128df7707008a59025239","manifest_digest":"sha256:9c6c3c7992277baa653e58a316b9add80311f905001555a1d19a2e8b11b333da","portfolio_id":"ask.portfolio.prompt-v2.claude","revision":"prompt-v2-baseline-v1"},"to_state":"historical"},{"from_state":null,"manifest":{"asset_set_digest":"sha256:dd2a7eb389722cbe7f880f198917b630839311e98c044e76ae69efcccb618de2","manifest_digest":"sha256:44c1ab664588a862014aa18fb309f2dbcedb09ee1d8fbac7b87f026153e636d0","portfolio_id":"ask.portfolio.prompt-v2.claude","revision":"prompt-v2-challenger-v1"},"to_state":"current"}]}
