{"authority":{"authority_evidence_digest":"sha256:8f159987be38d11d76096bf7c198c98b324cca48b6f40cad5e8b694685c85073","authority_id":"issue-278-sample-human-maintainer","authority_revision":"3","kind":"external_portfolio_activation_authority"},"context_digest":"sha256:92c4d9ae524680aaf2f9028a8a63e2b0e2585821b4de82c7d673e104fb9e647f","grant_basis_digest":"sha256:4f53cda18c2baa0c0354bb5f9a3ecbe5ed12ab4d8e11ba873c2f11161202b945","grants":[],"object_kind":"portfolio_authority_context","portfolio_id":"ask.portfolio.issue278.sample-runtime","predecessor_lock_digest":"sha256:4e771bfb45ba55e473bbef342fb0139171a2d30a14088e285bfb582c3097f800","repository_id":"github.com/ist-h-i/agent-spectrum-kernel","rollback_target":null,"schema_version":"1.0.0","scope_id":"agent-spectrum-kernel","transition_basis_digest":"sha256:e8582f621d38c5884f36cccfa29a530a6ed38f9c9792340bf1ffac110f6139d5","transitions":[{"from_state":"current","manifest":{"asset_set_digest":"sha256:06ef54d6a0516d07d2b058a08b8a291d37f8e884bdb2ba6a924661776e8fb460","manifest_digest":"sha256:01b90828482e22833c6e246872c05b7a20349a0357eef8f9be9d587add0b893f","portfolio_id":"ask.portfolio.issue278.sample-runtime","revision":"sample-baseline-v1"},"to_state":"superseded"},{"from_state":null,"manifest":{"asset_set_digest":"sha256:21e68b89466702a19cbaf4213f8927ba52498ab14ca21e67aec17d9c60ba7eab","manifest_digest":"sha256:c9ab3115073d7d50b2b099ee1ca8b08a15f5f962a71e3c9fe56e8e5bc90f584b","portfolio_id":"ask.portfolio.issue278.sample-runtime","revision":"sample-candidate-canary-v2"},"to_state":"current"}]}
