{"authority":{"authority_evidence_digest":"sha256:37bd9c3c21bfb3a3d508199dcfa67c018198d5c1f6a09653d38a40a48c2430e0","authority_id":"issue-278-sample-evaluation-portfolio-authority","authority_revision":"1","kind":"external_portfolio_activation_authority"},"context_digest":"sha256:b5228d0841a806317ba0421436276f616e14ca097cc89169bb60da4e3a950952","grant_basis_digest":"sha256:4f53cda18c2baa0c0354bb5f9a3ecbe5ed12ab4d8e11ba873c2f11161202b945","grants":[],"object_kind":"portfolio_authority_context","portfolio_id":"ask.portfolio.issue278.sample-evaluation","predecessor_lock_digest":"sha256:c4f0c14e08cda87699af094883c46123fff5bd6a9488febc13b1a66c709e4089","repository_id":"github.com/ist-h-i/agent-spectrum-kernel","rollback_target":null,"schema_version":"1.0.0","scope_id":"agent-spectrum-kernel","transition_basis_digest":"sha256:108a7ff34f636590726ab0830ead0181e4ee85670f81930838d08d8d0cf0c75e","transitions":[{"from_state":null,"manifest":{"asset_set_digest":"sha256:2e39061606b95f53b482e4aedf368f555d5e5be3f4a63eddc19e81e87006f963","manifest_digest":"sha256:2b9550fef6878114702bf2b318f9e6b02460694e8b295b148dc77a054a5aff6d","portfolio_id":"ask.portfolio.issue278.sample-evaluation","revision":"sample-challenger-v1"},"to_state":"current"}]}
