{"authority":{"authority_evidence_digest":"sha256:5679f2f21781d0d1e912a4e49cec39bb7fe3e0607c436fd432afade0b2231a74","authority_id":"issue-278-sample-human-maintainer","authority_revision":"3","kind":"external_portfolio_activation_authority"},"context_digest":"sha256:fd8bf2ea1c5d49693564d26cbd371dbfa2cd037460e00640323befc0f9856cc2","grant_basis_digest":"sha256:4f53cda18c2baa0c0354bb5f9a3ecbe5ed12ab4d8e11ba873c2f11161202b945","grants":[],"object_kind":"portfolio_authority_context","portfolio_id":"ask.portfolio.issue278.sample-runtime","predecessor_lock_digest":"sha256:c156f2106ecabd6a0275d519d6b31237850fbfd21103c5ed766314294b3367f0","repository_id":"github.com/ist-h-i/agent-spectrum-kernel","rollback_target":null,"schema_version":"1.0.0","scope_id":"agent-spectrum-kernel","transition_basis_digest":"sha256:f611c84df8847cb8f37a176b34b1d33df19de7a7f95362a46a81e99a68739028","transitions":[{"from_state":"current","manifest":{"asset_set_digest":"sha256:06ef54d6a0516d07d2b058a08b8a291d37f8e884bdb2ba6a924661776e8fb460","manifest_digest":"sha256:f7be1b013f6e96041848e63388aeba6e72786f3dcb31cc9f21b0282a3e01aa21","portfolio_id":"ask.portfolio.issue278.sample-runtime","revision":"sample-baseline-v1"},"to_state":"superseded"},{"from_state":null,"manifest":{"asset_set_digest":"sha256:21e68b89466702a19cbaf4213f8927ba52498ab14ca21e67aec17d9c60ba7eab","manifest_digest":"sha256:8e987ccdea2f6cb42a27549246a6590ea7299f4c897833767ae64d3b7dce9bfc","portfolio_id":"ask.portfolio.issue278.sample-runtime","revision":"sample-candidate-canary-v2"},"to_state":"current"}]}
