{"authority":{"authority_evidence_digest":"sha256:0fd87596f6e807135c26e8257749475fe812b90ee7ce7c8e6072226ac67794c5","authority_id":"ask.portfolio.sample-authority","authority_revision":"kernel-only-v1","kind":"external_portfolio_activation_authority"},"context_digest":"sha256:55b73fca327b3af00475e7b0283de314a5b1786b2fa398575bb8362cecf28bc6","grant_basis_digest":"sha256:4f53cda18c2baa0c0354bb5f9a3ecbe5ed12ab4d8e11ba873c2f11161202b945","grants":[],"object_kind":"portfolio_authority_context","portfolio_id":"ask.portfolio.reference","predecessor_lock_digest":"sha256:eaaa0fffdde78c9f8dee3ef38168ee948b1d79111b86d6815144285e77a21821","repository_id":"github.com/ist-h-i/agent-spectrum-kernel","rollback_target":null,"schema_version":"1.0.0","scope_id":"agent-spectrum-kernel","transition_basis_digest":"sha256:389b8506795296de5f6830721321b64ab45276d12ca0d2a9224d0fdf578d2f43","transitions":[{"from_state":null,"manifest":{"asset_set_digest":"sha256:4f53cda18c2baa0c0354bb5f9a3ecbe5ed12ab4d8e11ba873c2f11161202b945","manifest_digest":"sha256:521828aea1751c4f70e1915131f9751bf8a38f5b65aaf59a2155e248cb0200cd","portfolio_id":"ask.portfolio.reference","revision":"reference-kernel-only-v1"},"to_state":"current"}]}
