{"authority":{"authority_evidence_digest":"sha256:cfc3719f3aac7f6b0560af328e6f95ed40c86fbac9e31f910b692f2ff8257549","authority_id":"ask.prompt-v2.codex.baseline-portfolio-authority","authority_revision":"1710b3007d60e249d553ca7a43b5a83937066b61","kind":"external_portfolio_activation_authority"},"context_digest":"sha256:75f629f7b0bec36e533e9ac39b400b7b7ced99bf88f10c6b6b8b8ea21270e0ef","grant_basis_digest":"sha256:4f53cda18c2baa0c0354bb5f9a3ecbe5ed12ab4d8e11ba873c2f11161202b945","grants":[],"object_kind":"portfolio_authority_context","portfolio_id":"ask.portfolio.prompt-v2.codex","predecessor_lock_digest":"sha256:7c9eb8e9f3441928c33ab41fe08351567d65bfb2bb1d2ae2852c93b3ac3464b7","repository_id":"github.com/ist-h-i/agent-spectrum-kernel","rollback_target":null,"schema_version":"1.0.0","scope_id":"agent-spectrum-kernel","transition_basis_digest":"sha256:20220deb905e23e57ed78f02986348be7dbf254526394ed8892e1c8777c575d9","transitions":[{"from_state":null,"manifest":{"asset_set_digest":"sha256:346873c682a7f2168407145e68f6cbfe36840adb1e656924c809e10fde03fdfa","manifest_digest":"sha256:89ff3b3db198064ec6ef225c5c9c3a94dfb8b734c8e8950ac9079fe9d2f2d773","portfolio_id":"ask.portfolio.prompt-v2.codex","revision":"prompt-v2-baseline-v1"},"to_state":"current"}]}
