{"authority":{"authority_evidence_digest":"sha256:3d2124696b13b8c6d5b2a85b88d5d97c6ba33c4ebc8209ff3c5a544a144a049b","authority_id":"ask.portfolio.sample-authority","authority_revision":"adaptive-ask-v1","kind":"external_portfolio_activation_authority"},"context_digest":"sha256:d94a3ce1d2bb440b5788e9ac5ba196ffe5b34c9d248d7be8e63ffc7fc99b4e5e","grant_basis_digest":"sha256:4f53cda18c2baa0c0354bb5f9a3ecbe5ed12ab4d8e11ba873c2f11161202b945","grants":[],"object_kind":"portfolio_authority_context","portfolio_id":"ask.portfolio.reference","predecessor_lock_digest":"sha256:2b096afb1739764ae015552af32291b7d6676dbd2f9f8380cbc4540b242c4959","repository_id":"github.com/ist-h-i/agent-spectrum-kernel","rollback_target":null,"schema_version":"1.0.0","scope_id":"agent-spectrum-kernel","transition_basis_digest":"sha256:137698423701879162e690e738986d6bcf8d3cf0502645939712e9c85a5d74ce","transitions":[{"from_state":null,"manifest":{"asset_set_digest":"sha256:bf7aa0a97dbdd6fa46453e661ce05482e3619062f9fc949d916e2fdc6c11a329","manifest_digest":"sha256:00399989ee4be2513f4b8e112603f87e1fb3e7f84c514f91c59a81049b2d7c9e","portfolio_id":"ask.portfolio.reference","revision":"reference-adaptive-ask-v1"},"to_state":"current"},{"from_state":"current","manifest":{"asset_set_digest":"sha256:4f53cda18c2baa0c0354bb5f9a3ecbe5ed12ab4d8e11ba873c2f11161202b945","manifest_digest":"sha256:e116cc23d57fca4594e903ea8a6aeb4b85d2b82dd2470ddc0758acd3cef8b747","portfolio_id":"ask.portfolio.reference","revision":"reference-kernel-only-v1"},"to_state":"superseded"}]}
