{"authority":{"authority_evidence_digest":"sha256:41f5902f371fc837b5363f345d3cbb2b435ef2a347ebf0a03b0998dc2c2e15e7","authority_id":"ask.prompt-v2.codex.challenger-portfolio-authority","authority_revision":"1710b3007d60e249d553ca7a43b5a83937066b61","kind":"external_portfolio_activation_authority"},"context_digest":"sha256:b67564bd90dc054354e27c554836d2dd7bfc5e2378ef8f7a83309fe7c77b61b8","grant_basis_digest":"sha256:4f53cda18c2baa0c0354bb5f9a3ecbe5ed12ab4d8e11ba873c2f11161202b945","grants":[],"object_kind":"portfolio_authority_context","portfolio_id":"ask.portfolio.prompt-v2.codex","predecessor_lock_digest":"sha256:20ef152817c19bed997fdbfee1f0bf939df860c0f56fe1886c6347497a606fbd","repository_id":"github.com/ist-h-i/agent-spectrum-kernel","rollback_target":null,"schema_version":"1.0.0","scope_id":"agent-spectrum-kernel","transition_basis_digest":"sha256:19d82d1821eca603753bdc6bb8d24d91fa867dbf79b35bd5e0c2f836916a52f2","transitions":[{"from_state":"current","manifest":{"asset_set_digest":"sha256:346873c682a7f2168407145e68f6cbfe36840adb1e656924c809e10fde03fdfa","manifest_digest":"sha256:89ff3b3db198064ec6ef225c5c9c3a94dfb8b734c8e8950ac9079fe9d2f2d773","portfolio_id":"ask.portfolio.prompt-v2.codex","revision":"prompt-v2-baseline-v1"},"to_state":"historical"},{"from_state":null,"manifest":{"asset_set_digest":"sha256:3e3c9e0b02c3d27d9d1ee14c13d97d509557ad750b57b3d77b05e171abc68906","manifest_digest":"sha256:597b7348300a16339baddd09233d611eb2cd63bb0ac50e6808f47422c42bbf54","portfolio_id":"ask.portfolio.prompt-v2.codex","revision":"prompt-v2-challenger-v1"},"to_state":"current"}]}
